{
  "schema_version": "0.1",
  "id": "metrics",
  "created_at": "2026-10-21T14:02:11+08:00",
  "updated_at": "2026-10-21T16:21:30+08:00",
  "session_id": "2026-10-21-llm-salary-gap",
  "type": "research-report",
  "tier": "standard",
  "ai": {
    "rounds": [
      {
        "round": 1,
        "started_at": "2026-10-21T14:07:02+08:00",
        "ended_at": "2026-10-21T14:31:05+08:00",
        "reviewer_agents": 4,
        "candidates": 11,
        "kept": 2,
        "dropped_no_evidence": 6,
        "dropped_by_verifier": 2,
        "dropped_duplicate": 1
      },
      {
        "round": 2,
        "started_at": "2026-10-21T15:58:40+08:00",
        "ended_at": "2026-10-21T16:09:12+08:00",
        "reviewer_agents": 2,
        "candidates": 3,
        "kept": 0,
        "dropped_no_evidence": 2,
        "dropped_by_verifier": 1
      }
    ]
  },
  "human": {
    "minutes": 18,
    "measured_by": "self_report"
  },
  "findings": {
    "by_severity": {
      "S1": 1,
      "S2": 1,
      "S3": 0
    },
    "by_reaction": {
      "fixed": 1,
      "class_of_problem": 1
    },
    "precision": 1.0
  },
  "feedback_count": 6,
  "predictions": [
    {
      "decision_id": "D02",
      "predicted": "女性低 3% 左右，显著",
      "actual": "-4.1%，p<0.001",
      "match": "partly"
    }
  ],
  "quality": {
    "at_signoff": 4
  }
}
